{
  "$schema": "https://json-schema.org/draft/2020-12/schema",
  "title": "OpenPhenology cities/1",
  "description": "A state's cities, villages and census-designated places, and the counties each falls in (ODR-2026-040).",
  "type": "object",
  "required": [
    "id",
    "kind",
    "format",
    "provenance",
    "data"
  ],
  "properties": {
    "id": {
      "description": "The file's path from the API root.",
      "type": "string",
      "pattern": "^releases/\\d{4}-\\d{2}-\\d{2}/places/[a-z]{2}-[a-z0-9]{1,3}/cities(/\\d+)?\\.json$"
    },
    "kind": {
      "description": "The format's name, such as `county-weekly`.",
      "const": "cities"
    },
    "format": {
      "description": "Format name and version, for example `county-weekly/1.0`.",
      "type": "string",
      "pattern": "^cities/1\\.\\d+$"
    },
    "provenance": {
      "description": "Where the content came from.",
      "type": "object",
      "required": [
        "release",
        "sources",
        "licences",
        "gbif_download_dois",
        "method",
        "taxonomy",
        "boundaries",
        "ranges",
        "protection",
        "code",
        "run"
      ],
      "properties": {
        "release": {
          "description": "The release the file belongs to, such as `2026-10-19`.",
          "type": "string",
          "pattern": "^\\d{4}-\\d{2}-\\d{2}$"
        },
        "sources": {
          "description": "Source IDs, as listed in `sources.json`.",
          "type": "array",
          "items": {
            "type": "string"
          }
        },
        "licences": {
          "description": "The licences of those sources.",
          "type": "array",
          "items": {
            "type": "string"
          }
        },
        "gbif_download_dois": {
          "description": "The GBIF downloads the records came from, as DOIs.",
          "type": "array",
          "items": {
            "type": "string"
          }
        },
        "method": {
          "description": "The method version, such as `seasonal-3`.",
          "anyOf": [
            {
              "type": "string"
            },
            {
              "type": "null"
            }
          ]
        },
        "taxonomy": {
          "description": "The taxonomy version species keys come from.",
          "anyOf": [
            {
              "type": "string"
            },
            {
              "type": "null"
            }
          ]
        },
        "boundaries": {
          "description": "The boundary version areas come from.",
          "anyOf": [
            {
              "type": "string"
            },
            {
              "type": "null"
            }
          ]
        },
        "ranges": {
          "description": "Each mapped range edition used.",
          "anyOf": [
            {
              "type": "array",
              "items": {
                "type": "string"
              }
            },
            {
              "type": "null"
            }
          ]
        },
        "protection": {
          "description": "The version of each sensitive-species list applied, by list.",
          "anyOf": [
            {
              "type": "object",
              "additionalProperties": {
                "type": "string"
              }
            },
            {
              "type": "null"
            }
          ]
        },
        "code": {
          "description": "The commit of the code that produced the file.",
          "anyOf": [
            {
              "type": "string"
            },
            {
              "type": "null"
            }
          ]
        },
        "run": {
          "description": "The run that produced the file.",
          "anyOf": [
            {
              "type": "string"
            },
            {
              "type": "null"
            }
          ]
        }
      }
    },
    "data": {
      "description": "The content, as the format sets out.",
      "type": "object",
      "required": [
        "cities"
      ],
      "properties": {
        "cities": {
          "description": "Every place, by name; places that share a name each have an entry.",
          "type": "array",
          "items": {
            "type": "object",
            "required": [
              "name",
              "type",
              "area",
              "also_in"
            ],
            "properties": {
              "name": {
                "description": "Its Census name without the type word, such as `Dublin`.",
                "type": "string",
                "minLength": 1
              },
              "type": {
                "description": "`city`, `village` or `cdp` (census-designated place).",
                "enum": [
                  "city",
                  "village",
                  "cdp"
                ]
              },
              "area": {
                "description": "The county it leads with: the one holding its Census internal point.",
                "type": "string",
                "pattern": "^\\d{5}$"
              },
              "also_in": {
                "description": "Its other counties, possibly none.",
                "type": "array",
                "items": {
                  "type": "string",
                  "pattern": "^\\d{5}$"
                }
              }
            }
          }
        }
      }
    }
  }
}
